Type,Icon,Title,Artist,Description EN,Description PT,Link,Status
featured,🎧,BBC Learning English,,Great for training your ear with a clear British accent — slow and easy to understand.,Ótimo para treinar o ouvido com sotaque britânico devagar e claro!,https://www.youtube.com/@BBCLearningEnglish,
song,🐣,Chicken Little,Modern Fable · Fábula Moderna,Our class story! Practice what we learned together.,A história da nossa aula!,,completed
song,🎸,Let It Be,The Beatles,Simple words beautiful melody. Perfect for A1 listening practice.,Palavras simples melodia linda.,https://www.youtube.com/results?search_query=let+it+be+beatles+lyrics,
song,☀️,Here Comes the Sun,The Beatles,Great for routines vocabulary!,Ótimo para vocabulário de rotinas!,https://www.youtube.com/results?search_query=here+comes+the+sun+beatles+lyrics,
song,🌹,La Vie en Rose,Édith Piaf (English version),A beautiful classic. The English lyrics are simple and poetic.,Um clássico lindo letras simples em inglês.,https://www.youtube.com/results?search_query=la+vie+en+rose+english+lyrics,
